id,text
296910776336273408,Flood relief appeal for Australia's Pacific islanders | Pacific Beat | ABC Radio Australia http://t.co/hUGWwFHB via @sharethis
297312473189588993,Rain again??? Australia hasn't fully recovered from last weekend's downpour & flood. God let there be no flood again. #qldflood
295740033284067328,RT @bravotrav: Tony Abbott is visiting flood affected areas of Queensland today. I'm sure he'll remind Queenslanders he opposed the floo ...
296102158481358848,@toohsuite Photos: Flood water rises in Australia
296039252788129792,RT @australian: Brisbane braces for flood peak: HUNDREDS of homes in Ipswich have escaped inundation in Queensland's flood crisi... http ...
296154000875716608,Queensland counts flood cost as New South Wales braces for river peaks: Four deaths confirmed from torrential ra... http://t.co/LkziU1k9
296315984741007361,RT @newscientist: Climate change blamed as #Australia lurches from fire to flood http://t.co/szxtcw7m #extremeweather
295466207988047872,Actually getting worried that the creek may flood the house :/ Damn you Australia and your retarded weather!!
295761609228431360,Queensland's flood crisis deepens - The Australian: Sky News AustraliaQueensland's flood crisis deepensThe Austr... http://t.co/B2dcRL7a
296015112509222912,Flood crisis claims fourth victim: A three-year-old boy became the fourth and youngest victim of Queensland's fl... http://t.co/p7k6G6zk
295756601166548992,Queensland's flood crisis deepens as death toll rises to three - The Australian http://t.co/BicL3R4V
295662093938606080,RT @aippnational: To all our members and friends in flood affected Queensland. We are thinking if youhope you stay safe.
295855732295864320,Does Victoria not get 24/7 Queensland flood coverage this time around because the ratings period is starting?
296271167369662465,"More than 7K displaced in Queensland flood: BUNDABERG, Australia, Jan. 29 (UPI) --  More than 7,000 people have ... http://t.co/f1xvwzRD"
296385469351088128,Two missing as Queensland's flood recovery begins - http://t.co/hJAbvEcT: Sky News AustraliaTwo missing as Queens... http://t.co/HZA40Wfi
296508666872463360,Clean-up launched after deadly Australian floods: A mammoth clean-up operation has begun in Australias flood-hi... http://t.co/HeTxFYhp
295871915254509568,"Baby stuffed in bag, hoisted from flood - Australia's powerful storms led to an amazing rescue of two women and a ba... http://t.co/nsBFXPMo"
295837926321954817,"My heart goes out to everyone around Australia who have been effected by the Natural Disasters, fire or flood. Heartbreaking images."
296771854629228544,Queensland floods: motivation to get flood planning right http://t.co/GFw60V1g via @conversationedu
296557889814925313,Queensland flood toll rises to six - The Age: Brisbane TimesQueensland flood toll rises to sixThe AgeTwo dead fa... http://t.co/FL45tQj3
295866925085503494,"Baby stuffed in bag, hoisted from flood: Australia's powerful storms led to an amazing rescue of two women and a... http://t.co/Z9qD2sud"
296151683627618304,Queensland counts flood cost as New South Wales braces for river peaks: Four deaths confirmed from torrential ra... http://t.co/P0kKDY2B
295730692271251456,"@Harry_Styles it's flooding and there's tornadoes in Queensland, my house is about to flood it's really scary :( 7"
296144821687562240,Queensland counts flood cost as New South Wales braces for river peaks: Four deaths confirmed from torrential ra... http://t.co/9MddWxg0
295684629665566720,Queensland coast on flood watch | oncirculation http://t.co/xTcUCwKr
295656439609950208,"RT @lopez_mdMx: Qld premier launches flood appeal: THE Queensland Flood Appeal has been launched by the premier, who kick-starte... http ..."
295688966223564801,"Watching the flood news for Queensland and Brisbane, praying for the best for everyone."
296532333950029824,Body of sixth victim found as Queensland's flood recovery begins - http://t.co/ADP7GUsU http://t.co/lupciMY1
295876844094373888,@TenLateNews Was the Opposition Leader wrong to tour flood ravaged Queensland rather than bushfire affected Victoria?
296337109185351680,Clean up begins in flood-stricken Queensland - New Zealand Herald: New Zealand HeraldClean up begins in flood-st... http://t.co/4QGtmKXz
295756597714632704,Queensland's flood crisis deepens as death toll rises to three - The Australian http://t.co/6pZW8wfH
296048536116674560,What a sad time for #queensland the #flood effects are devastating & here is how we can all help our fellow #australian http://t.co/RrsysqAb
295636305398886400,"RT @NickBryantOz: An only in Australia? Prime Minister visits fire-affected communities, opposition leader visits flood-affected communi ..."
296500466865545217,"Body of sixth victim found as Queensland's flood recovery begins: In worst-hit Bundaberg, which was devastated a... http://t.co/pesnrtfV"
296084539581800448,RT @AJEnglish: Deadly flood waters rise in eastern Australia http://t.co/UDIcfaPq
296358698404691968,"Immigration reform , dozens of Syrians dead, Egypt is about to lose their democracy , flood in Australia, fire in brazil ... Anything else?"
295809108253220864,RT @berkeleyboy: The cameras click & Tony Abbott fills a sandbag for Queensland... But Govt money for flood victims? No! http://t.co ...
296870372790394880,Flood damage bill to top 2011 disaster: THE damage bill from the Queensland floods is expected to pass even the ... http://t.co/8rtv3hwF
296191461576302592,'Queensland counts flood cost as New South Wales braces for river peaks' [@Guardian] http://t.co/j7AvWYTg
297412780292726785,Unions claim job losses in Queensland public sector have hindered flood ... - from @News_com_au : http://t.co/54QcmUdn
296249345743925248,ew South Wales braces for river peaks a Queensland counts flood cost http://t.co/o1B8AGE4
296004387187347457,RT @Y7News: Death toll from Queensland flood crisis rises to four following the death of a three-year-old boy http://t.co/PmELZbCx #Qldf ...
295726642314223616,"My prayers to all the people in the Brisbane,, Queensland flood #flood #cyclone #oswald #brisbane, my mum used to live in Brisbane.."
295754800316952576,"RT @tvitin: Gillard should be removed from Queensland, It's hard enough.. fighting flood and fires."
296073498860863489,sodebaba Deadly flood waters rise in eastern Australia: At least four people dead as torrential rains severely f... http://t.co/omIrTUgA
295724906807701504,RT @bondifilmfest: Our thoughts go out to all the flood victims and animals across QLD Australia. Keep safe! http://t.co/WLxpf0rK
296172153211060224,New South Wales braces for river peaks as Queensland counts flood cost http://t.co/bgDheETc
295867025715249154,"Baby stuffed in bag, hoisted from flood: Australia's powerful storms led to an amazing rescue of two women and a... http://t.co/FkgLP7A3"
296806285079355393,- Food supply risk from floods - \\Queensland's flood has left farmers with a devastating damaging bill and... http://t.co/6jknzARh
296006768880939008,Brisbane braces for flood peak: HUNDREDS of homes in Ipswich have escaped inundation in Queensland's flood crisi... http://t.co/OaKz1uVl
295685355829600256,Brisbane braces as major Queensland flood crisis unfolds: Click to play video Return to video Video settings Ple... http://t.co/UExLB3Uu
295689140387840000,Watching this queensland flood thing *sighs*
295807829309288448,Helicopters Deployed to Rescue Flood Victims in Australia - Businessweek: http://t.co/DiP8jqaJ.auHelicopters Depl... http://t.co/iYriTJf8
296116851006652417,RT @612brisbane: .@theqldpremier - Red Cross Queensland Flood Appeal 1800 811 700 or http://t.co/UEVKQppi
295756361931816960,RT @bravotrav: Tony Abbott is visiting flood affected areas of Queensland today. I'm sure he'll remind Queenslanders he opposed the floo ...
296559636335714304,Queensland flood toll rises to six - The Age http://t.co/3A8bSKez #news
295741364157702145,WOW it's flooding again in Queensland and NSW ?? Glad I Live in Perth it can't flood here ??
296248670427439106,RT @newscientist: Climate change blamed as #Australia lurches from fire to flood http://t.co/IvM2hW2d #extremeweather
295816480992419841,Flood hits Queensland and foam car appears out of nowhere FUNNY - http://t.co/7I4iPglk
296387053845880832,http://t.co/YOrqO568 Fears Qld flood death toll will climb: There are fears Queensland's flood death toll could r... http://t.co/VJrBz9MN
296072431079153664,Deadly flood waters rise in eastern Australia http://t.co/QGaIuLMB
295894396887498753,Australian Government Bureau of Meteorology\Queensland\\FLOOD WARNING FOR THE MOONIE RIVER\Issued at 6:56 pm EST... http://t.co/14C7Jz8j
296147186171924480,StarsSoft Queensland counts flood cost as New South Wales braces for river peaks - The Guardian: The GuardianQue... http://t.co/3sJWzZBM
295756595915264000,Queensland's flood crisis deepens as death toll rises to three - The Australian http://t.co/WVFkmjsm
295712298486607873,So over these flood in Queensland. Hope no one else gets hurt #floods #stuckindoors
295882397734539265,"RT @bradgully: My heart goes out to everyone around Australia who have been effected by the Natural Disasters, fire or flood. Heartbreak ..."
295924209794818048,The Queensland Government has launched the Queensland Flood Appeal 2013. Donations can be made through Red Cross: http://t.co/6j9YI7Gl
296818994466406400,Flood assistance for Queensland small businesses http://t.co/gil9x9hY
296103899155271680,Crazy Sea Foam flood in Australia..  http://t.co/SX8attOk
295733971743027200,Will it flood? #Ipswich #bremerriver #Brisbane #Australia #flood #question http://t.co/huhDkzvU
295984138329133056,RT @thetodayshow: TOP OF THE HOUR - The very latest on the flood crisis with our reporters across Queensland & New South Wales #qldf ...
297219627925250048,"RT @Adventist_News: Adventists in Melbourne, Australia are collecting new underwear to help Bundaberg Flood Victims. The project is call ..."
296060679159435264,RT @brisbanetimes: Keep up to date with the flood situation in Queensland with our live blog: #BrisLive http://t.co/Z7EcAa4K
296079355208155137,Deadly flood waters rise in eastern Australia http://t.co/UDIcfaPq
295888192991801344,RT @9NewsBrisbane: Flood Crisis: @TheTodayShow will be live into Queensland from 4am with continuing coverage of the floods in Queenslan ...
296084204117188608,Idiot hipster boasts swimming in Brisbane flood water #bigwet #qldfloods #queensland #brisbane #bnestorm #brisbaneriver http://t.co/6PYdR482
295788373229072385,"#News Al Jazeera English on Jan 28, 2013 at 06:55 AM: Flood worsens in eastern Australia ht... http://t.co/UPUfJaQY http://t.co/UMzhODj0"
296425847710154752,RT @surfqld: SLSA recognises and thanks SLSQ surf lifesavers' great work during the flood crisis in Queensland. http://t.co/6dpN2Tol
295732978997424128,RT @bravotrav: Tony Abbott is visiting flood affected areas of Queensland today. I'm sure he'll remind Queenslanders he opposed the floo ...
296147224080048129,Queensland counts flood cost as New South Wales braces for river peaks http://t.co/GKIh2bO2 #TheGuardian
296045736708153344,Thinking of all those aussies affected by fires and floods!! #bushfire #flood #Australia
295475825430654976,RT @7NewsBrisbane: Foam from rough waves at Alexandra Headland resembles snow on the Sunshine Coast #staysafe #bigwet #queensland #flood ...
295985816650539009,Australia's flood crisis worsens as death toll rises - TVNZ: Brisbane TimesAustralia's flood crisis worsens as d... http://t.co/wOP1albZ
296099855347097600,"RT @ASNSW: Our thoughts are with all residents of flood affected areas of NSW, Victoria and Queensland today. NSW residents... http://t. ..."
295646748892872705,RT @7NewsSydney: #Queensland flood crisis useful links and contacts http://t.co/lNFjny9C
295867318452490241,"Baby stuffed in bag, hoisted from flood: Australia's powerful storms led to an amazing rescue of two women and a... http://t.co/jegqCm2z"
297099665436966913,Former Kiwi found safe in Queensland flood zone: An 82-year-old former Masterton resident has been located by In... http://t.co/O3zb9svv
296100361909964800,Photos: Flood water rises in Australia http://t.co/Dzr4jOUj
296411875770515456,The recovery effort begins as a water crisis hits the flood-ravaged state of Queensland. Read more in today's news: http://t.co/cZ9A0aWa
296436987701915648,@TheEllenShow PLEASE HELP THE #Queensland AUSTRALIA RED CROSS in the flood affected families especially in Bundaberg and Gympie!!! #redcross
295866445332639745,"Baby stuffed in bag, hoisted from flood: Australia's powerful storms led to an amazing rescue of two women and a... http://t.co/blcXlKzr"
295841365630259201,RT @AussiieBelieber: Praying for all the flood and fire victims in Australia!
295987151512928256,Your pictures: Queensland flood crisis http://t.co/4usHPiDH @abcnews @612brisbane #bigwet
296260835003736064,Related --&gt;  Central and southern Queensland face a mammoth recovery task as record-breaking flood waters rec ...  http://t.co/zts632zx
295636700036730880,#Queensland flood crisis useful links and contacts http://t.co/rI0XRyvK
296077486180163584,Deadly flood waters rise in eastern #Australia: http://t.co/bzifIBLF
295795713701462016,My prayers go out to those who are affected by Queensland's worst flood.
295865504537669633,"Baby stuffed in bag, hoisted from flood: Australia's powerful storms led to an amazing rescue of two women and a... http://t.co/HYVM9BLQ"
295497476625014784,RT @7NewsBrisbane: Foam from rough waves at Alexandra Headland resembles snow on the Sunshine Coast #staysafe #bigwet #queensland #flood ...
296817485024468992,Qld flood prompts town planning rethink: The Queensland government says it's time to reconsider building public ... http://t.co/tRLqBYnY
295762111404060672,Only in Australia do u find a woman outside in the middle of flood cutting her hedge that is completly underwater
296985186644668416,"RT @stinkypoocrust: Australia - if you aren't being swept away in a flood, you're being burnt alive  while seeking asylum on an island n ..."
296545056666562560,Queensland flood toll rises to six - Herald Sun: Sydney Morning HeraldQueensland flood toll rises to sixHerald S... http://t.co/lEVSnGbl
295810845299052546,RT @sunriseon7: Latest on the Queensland flood crisis can be found here: http://t.co/YKVPS8tH #sun7 #qldfloods #bigwet
296010294604484608,RT @AustraliaVote: Complaints from #Queensland floodies at lack of services in some flood disaster areas Thanx Newman #LNP #auspl #Qldpo ...
295724305554210817,Get over it don't Fucken care what u say flood victims are more important than so fucken follow me shit Queensland needs u
296079551900053504,RT @AJEnglish: Deadly flood waters rise in eastern Australia http://t.co/UDIcfaPq
295716579021291521,Rolling coverage: Queensland flood crisis toll mounting | Gatton Star http://t.co/XXNjPc8T #weather
296198686705324033,RT @greenpeacepress: Extreme weather can be the new normal: After unprecedented #heatwave #Australia faces massive #flood http://t.co/2q ...
296249121965240320,If you want to assist #Queensland #flood #volunteers get #baking and deliver to the @BakedRelief drop off points.
295729931269328896,"@JackVidgen @QantasAirways  Hey Jack. Hope your family is fine in Queensland, because of the flood. I tried to write you on facebook."
296487865905459200,Will he answer that question at the NPC tomorrow? RT @TrisD Big question is will Tony Abbott support a new flood levy for Queensland?
295984491149803521,"Australia's flood crisis worsens as death toll rises: The deadly flood crisis is escalating, as Brisbane and... http://t.co/cL5b7B7T"
295762198804971520,Queensland's flood crisis deepens - The Australian: Sydney Morning HeraldQueensland's flood crisis deepensThe Au... http://t.co/E7j1QHL1
296578200291639296,"@phips16 that's good you have no house damage and insurance, does it flood everywhere is Australia?"
296465108870254592,Body of fifth flood victim found: POLICE have found the body of Queensland's fifth flood victim in a car in the ... http://t.co/iQ2SbJby
297255420341399553,RT @Aussie_BeLIEver: Meanwhile in #australia Aussies keepn a jovial spirit in times of #flood ADD BUBBLE BATH 2 FLOOD WATER Aussies RT p ...
296779586363092992,Joel kontinen: More Evidences for the Genesis Flood in Australia:... http://t.co/NTNblK3x
296006788006940672,"BBC News -  'Major flood crisis' hits Queensland, Australia http://t.co/XwBMAuGT"
295756599795011585,Queensland's flood crisis deepens as death toll rises to three - The Australian http://t.co/JtLnN9MI
295866881414414336,"Baby stuffed in bag, hoisted from flood: Australia's powerful storms led to an amazing rescue of two women and a... http://t.co/Fnwtndsl"
295801212341723136,@awesome_alanna I saw how bad the flood was in New South Wales. Is it flooding in Queensland?!
295507466131738624,Qld again in grip of deadly flood disaster: At least four people are feared dead in Queensland's unfolding flood... http://t.co/4fHN8R21
295866156181491712,"Baby stuffed in bag, hoisted from flood: Australia's powerful storms led to an amazing rescue of two women and a... http://t.co/IVJgdlgX"
296344926092926976,New article: Helicopters Deployed to Rescue Flood Victims in Australia read more at here http://t.co/4T0tJnXm
296214453115027456,"There may be flooding in Queensland, but there is soon to be a flood in my bedroom from my tears. I don't wanna go!"
296356584366415872,RT @NewsTalk2UE: Search resuming for two men missing - feared drowned - in Queensland's flood affected Lockyer Valley http://t.co/LToj9D ...
295915241081024513,"(BBC) 'Major flood crisis' hits #Queensland, #Australia http://t.co/8OYtNeee #weather #environment #TheNewsCrew"
295907292589740032,"Australia faces flood 'crisis': The Australian state of Queensland is facing a major flood crisis its premier warns, as rescuers at..."
295778771779334145,'Winter wonderland' as foam blankets town during queensland flood crisis - Yahoo!7 http://t.co/PsWzALlX  via @Y7News
296419348388663299,Two missing as Queensland's flood recovery begins - Herald Sun http://t.co/ym0b4b8t
295691291591839744,Flooding hits eastern Australia: Hundreds of homes are inundated and and several people reported missing as flood waters rise in the ...
296010616689291264,The Queensland flood crisis has now claimed 4 lives. The latest on #bigwet with @Kaycie in the news at 9 and across the day on Heart 107.3
295787517624602624,RT @AJEnglish: Flood worsens in eastern Australia http://t.co/kuGSMCiH
295529318329765888,Daring rescue of teenager from flood waters: Australia reels from surging floods http://t.co/Qe5FcKlW
296012576612032513,SE Queensland and New South Wales are battling against vast areas of fast flowing destructive flood waters. Bundaberg Hospital evacuated.
296232640250519552,"#Flood killed 2 in two states, thousand evacuated from #floodarea in #Australia http://t.co/Ia7m2ElK via @MediaInternational"
296218134120132610,"RT @Andrew_J_Morley: Hearts go out out to the flood affected in Australia, and also to those in Mozambique, Africa. Also hit hard, 36 de ..."
297160212429803520,Looting hits Queensland flood spots http://t.co/cv4SVJJT
296056297273556992,@NiallOfficial Dealing with the highest flood record in... http://t.co/PDpDyj3T #Australia #Janoskiansonellenshow #QLD via @CelineSanders1
295709265761538049,My Thoughts and Prayers are with those who have died and who are still directly affected by the Flood in Queensland.
296801487521185793,The Queensland flood in pictures:\  http://t.co/1BcpzjBn
295744018439094273,Tony Abbott says Labor may seek new Queensland flood levy - The Australian: http://t.co/Uvmg84O2.auTony Abbott sa... http://t.co/pw8PUyEh
296753162294009856,Bitter Aftertaste of Queensland Flood is Higher Prices of Sugar in Global Markets http://t.co/sTB9Eaom #GlobalMarkets
296635489526616064,"RT @BetteMidler: 21/2 ft of rain fell on Queensland Australia yesterday, second major flood in two years."
295480889574559745,"RT @nialls_swag: When i see people praying Queensland won't flood to save a flash mob, instead of people's lives and homes. S E L F I S H"
296152987112443907,PAKIS RAPE KIDS: Flood continues hitting Australia's east coast: Floodwaters in Australia's e... http://t.co/d9u7QAUH #oldham #middleton
296021445664989184,Testing Flood crisis claims fourth victim - A three-year-old boy became the fourth and youngest victim of Queensland... http://t.co/w5kkMMhs
296669986422919169,@AntiquaTours seen this: Rescuers help Australia flood victims as waters recede http://t.co/dOQNBsMR
295547422153785344,Army on standby amid Queensland flood crisis http://t.co/8HiEoONS via @brisbanetimes @eopiniontv
296980610843566083,RT @storyofstuff: MT @350 No end in sight for Australia flood victims. Brisbane @ risk of running out of drinking water http://t.co/DN ...
295731887081676801,RT @DeaNoctis: Storm water drain overflowing at its starting point #ExTropicalCycloneOswald #Flood #Rain #Australia http://t.co/TiscRk6a
296247462778241024,RT @newscientist: Climate change blamed as #Australia lurches from fire to flood http://t.co/szxtcw7m #extremeweather
296422443126497280,RT @disaster_feed: Drinking water ok but concerns for asbestos in the post-flood clean up...  (audio): In Queensland as waters begi... h ...
296101253056954368,Photos: Flood water rises in Australia:  http://t.co/rZucu02b
295867295434145793,"Baby stuffed in bag, hoisted from flood: Australia's powerful storms led to an amazing rescue of two women and a... http://t.co/KQ3DqUqW"
295867412757233664,"Baby stuffed in bag, hoisted from flood: Australia's powerful storms led to an amazing rescue of two women and a... http://t.co/BWSFJm5n"
297098457703936000,DTN New Zealand: Former Kiwi found safe in Queensland flood zone: An 82-year-old former Masterton resident has b... http://t.co/gOovGhlC
296185340908142593,#news: New South Wales braces for river peaks as Queensland counts flood cost: Four deaths confir... http://t.co/LPfxlnWZ #guardianudate
296890810119630849,New South Wales braces for river peaks as Queensland counts flood cost http://t.co/OUKzm5mN
296742178439438336,Before & after photos of the Murrumbidgee - from flood to drought in a matter of months http://t.co/kUc7f2W1 #nsw #australia #photos
295769166076592128,RT @AnnastaciaMP: The Queensland Flood Appeal 2013 has been launched. Please donate by visiting http://t.co/335O63pM or contacting 1800  ...
296062328221351936,AUSTRALIA: Flood peaks expected shortly in some areas. Follow @syflpac/australia List for updates. More videos soon
295827237108842496,RT @Y7News: 7News Live streaming coverage of the #Queensland flood crisis http://t.co/E8LZoQeu #QldFloods
296252425436815360,RT @guardian: New South Wales braces for river peaks as Queensland counts flood cost http://t.co/cQoP8Xa5
296460706914631681,RT @SBSNews: Fifth Queensland flood death confirmed after body found in car http://t.co/eXA9nfv3
295516829126885378,"guys lets pray for all the people who live and affected on flood in australia,lets hope that they r all safe.."
295797012899717120,Please say a pray for those who affected by the flood around Australia!!!
296595652161454080,Scoopon Deals | Online - Donate to Red Cross Australia & Help Raise Funds for Flood Victims https://t.co/ObsBJY5p
295646879293779969,Queensland's flood crisis deepens - The Australian http://t.co/gd8TU3UM
296008433931542529,RT @australian: Brisbane braces for flood peak: HUNDREDS of homes in Ipswich have escaped inundation in Queensland's flood crisi... http ...
295636283294887936,#Queensland flood crisis useful links and contacts http://t.co/l1py4cen
295702689919148032,Julia Gillard visiting bushfire ravaged areas of Victoria. Tony Abbott visiting flood-hit Queensland. He doesn't believe in climate change.
295776756294639616,#TOPNews Sky News Australia Flood to inundate thousands of Bundaberg homesABC OnlineBlackhawk helicopters are... http://t.co/i8hMHMpV
296710931856105472,Australia lurches from fire to flood #climatechange #globalwarming http://t.co/x7XdOyl8
296810606605000706,queensland flood maps: QUEENSLAND FLOOD UPDATE - QUEENSLAND FLOOD UPDATE 12t... | Travcheq Travel\For more infor... http://t.co/KvSlzIZl
295700816977866753,Horrid flood from Queensland in 2011 has came to NSW O____O
297322056889032705,"RT @ClimateComms: Australia: Experts say this 1000 yr flood is more devastating than the last 1000 yr flood, which was only 2 years ago. ..."
296144652451606529,Queensland counts flood cost as New South Wales braces for river peaks: Four deaths confirmed from ... http://t.co/K7TTsIkm #environment
295847942059864064,Video I took today of the #flood raging near me in #Queensland #Australia... http://t.co/lo9P9IIc
296024694581243904,@LiveOfLight @aliyafrazier I didn't get to learn anything cos we had no electricity due to a massive flood event here in Queensland Aust!
295612362461966339,Severe weather warnings in place across south-east #Queensland and northern #NSW. For latest on Australian flood alert: http://t.co/oenHrGHT
296247792865787906,RT @newscientist: Climate change blamed as #Australia lurches from fire to flood http://t.co/szxtcw7m #extremeweather
295680168092106752,RT @SBSNews: The death toll from Queensland's flood crisis rises to three: http://t.co/IdodCU6N #bigwet
295756600872931330,Queensland's flood crisis deepens as death toll rises to three - The Australian http://t.co/0VjNQgr7
295866085289373696,"Baby stuffed in bag, hoisted from flood: Australia's powerful storms led to an amazing rescue of two women and a... http://t.co/Ga3RV0Sp"
296532863459942400,RT @AJEWeather: A clean-up operation is underway in NE #Australia as #flood waters begin to recede.
295758889297772544,RT @abcnews: LIVE: Queensland Premier Campbell Newman is giving an update on Queensland flood crisis http://t.co/4DvJcuYX
295759949366194176,Queensland's flood crisis deepens - The Australian: Sydney Morning HeraldQueensland's flood crisis deepensThe Au... http://t.co/nsfXq8xB
